Author,Quote,Book,Tags,Rating,Location,Link,Collected,RawSource,Created,id
"Thomas Mann","Such were Laban’s words and train of thought, judicious words clothing judicious thoughts. But even earthbound man’s thoughts—and not just his words—merely clothe and gloss over his endeavors and interests, and in thinking them he sets them into judicious form, so that usually he lies before he speaks, and his words have an honest ring because they are not the lie, but rather his thoughts are.","Joseph and His Brothers: The Stories of Jacob, Young Joseph, Joseph in Egypt, Joseph the Provider",,,"page 290 location 4434-4437",,"July 15, 2023","Kindle Import Timestamp 1692418692555","August 19, 2023 2:18 pm",
"Thomas Mann","No one claims that Jacob should have undertaken or entered upon these seven years with joy, for only after they had passed would he in fact be able to have children with Rachel.","Joseph and His Brothers: The Stories of Jacob, Young Joseph, Joseph in Egypt, Joseph the Provider",,,"page 297 location 4547-4548",,"July 15, 2023","Kindle Import Timestamp 1692418692555","August 19, 2023 2:18 pm",
"Thomas Mann","Pure waiting is agonizing torture, and no one could bear just to sit there or pace the floor while waiting out seven years, or even seven days, the way any of us can surely manage to do for an hour or so.","Joseph and His Brothers: The Stories of Jacob, Young Joseph, Joseph in Egypt, Joseph the Provider",,,"page 297 location 4554-4555",,"July 15, 2023","Kindle Import Timestamp 1692418692555","August 19, 2023 2:18 pm",
"Thomas Mann","Something imminently awaited, precisely because it is so near, is a far fiercer and more direct test of our patience than something far off, making of it an impatience that strains nerves and muscles, turning us into invalids literally uncertain of what to do with our arms and legs, whereas with long-term waiting we retain our calm, since it does not merely allow, but indeed forces us to think other thoughts,","Joseph and His Brothers: The Stories of Jacob, Young Joseph, Joseph in Egypt, Joseph the Provider",,,"page 298 location 4558-4561",,"July 15, 2023","Kindle Import Timestamp 1692418692555","August 19, 2023 2:18 pm",
"Thomas Mann","Something imminently awaited, precisely because it is so near, is a far fiercer and more direct test of our patience than something far off, making of it an impatience that strains nerves and muscles, turning us into invalids literally uncertain of what to do with our arms and legs, whereas with long-term waiting we retain our calm, since it does not merely allow, but indeed forces us to think other thoughts, do other deeds, for we must live. All","Joseph and His Brothers: The Stories of Jacob, Young Joseph, Joseph in Egypt, Joseph the Provider",,,"page 298 location 4558-4561",,"July 15, 2023","Kindle Import Timestamp 1692418692555","August 19, 2023 2:18 pm",
"Thomas Mann","Something imminently awaited, precisely because it is so near, is a far fiercer and more direct test of our patience than something far off, making of it an impatience that strains nerves and muscles, turning us into invalids literally uncertain of what to do with our arms and legs, whereas with long-term waiting we retain our calm, since it does not merely allow, but indeed forces us to think other thoughts, do other deeds, for we must live. All of which gives rise to the strange statement that with whatever degree of yearning we may wait, it is not harder, but easier to do, the farther ahead in time what we await may lie.","Joseph and His Brothers: The Stories of Jacob, Young Joseph, Joseph in Egypt, Joseph the Provider",,,"page 298 location 4558-4562",,"July 15, 2023","Kindle Import Timestamp 1692418692555","August 19, 2023 2:18 pm",
"Thomas Mann","If you wish to benefit from my blessing and for me to serve you with goodwill and cunning, some reward must beckon me, some incentive must spur me on, otherwise my soul will be limp and lame, and my blessing will not be at your service.”","Joseph and His Brothers: The Stories of Jacob, Young Joseph, Joseph in Egypt, Joseph the Provider",,,"page 302 location 4627-4628",,"July 15, 2023","Kindle Import Timestamp 1692418692555","August 19, 2023 2:18 pm",
"Thomas Mann","For all of life was not to be present exclusively in Jacob alone from now on, and he would no longer stand alone, the sole lord of his world; but instead, he was to dissolve into his sons, and his person be given over to death.","Joseph and His Brothers: The Stories of Jacob, Young Joseph, Joseph in Egypt, Joseph the Provider",,,"page 313 location 4794-4795",,"July 16, 2023","Kindle Import Timestamp 1692418692555","August 19, 2023 2:18 pm",
"Thomas Mann","And being unblemished, she shall wrap her head in it, and be as one of the unblemished enitu, like a bride of heaven, whom the priests bring to the god each year at the feast of Ishtar in Babel, leading her up the stairway and through the seven gates of the tower while everyone watches and removing a piece of her jewelry and attire at each gate, the cloth at her loins last of all, until they lead the holy naked girl into the highest bedchamber of the tower Etemenanki. There the god receives her upon his bed by the darkest darkness of","Joseph and His Brothers: The Stories of Jacob, Young Joseph, Joseph in Egypt, Joseph the Provider",,,"page 321 location 4910-4914",,"July 16, 2023","Kindle Import Timestamp 1692418692555","August 19, 2023 2:18 pm",
"Thomas Mann","And being unblemished, she shall wrap her head in it, and be as one of the unblemished enitu, like a bride of heaven, whom the priests bring to the god each year at the feast of Ishtar in Babel, leading her up the stairway and through the seven gates of the tower while everyone watches and removing a piece of her jewelry and attire at each gate, the cloth at her loins last of all, until they lead the holy naked girl into the highest bedchamber of the tower Etemenanki. There the god receives her upon his bed by the darkest darkness of night, and the mystery is very great.”","Joseph and His Brothers: The Stories of Jacob, Young Joseph, Joseph in Egypt, Joseph the Provider",,,"page 321 location 4910-4914",,"July 16, 2023","Kindle Import Timestamp 1692418692555","August 19, 2023 2:18 pm",
"Thomas Mann","“Let Me become holy in you, and you are to be holy as well!” In other words, the purification by which a shadowy, malicious god becomes a holy God includes, retroactively, humankind, in whom this is accomplished according to God’s urgent wish.","Joseph and His Brothers: The Stories of Jacob, Young Joseph, Joseph in Egypt, Joseph the Provider",,,"page 346 location 5296-5297",,"July 17, 2023","Kindle Import Timestamp 1692418692555","August 19, 2023 2:18 pm",
"Thomas Mann","And if you both are agreed as regards me, then it shall be so. For a man should not set himself against woman’s counsel, or kick against the decision and resolve of women.”","Joseph and His Brothers: The Stories of Jacob, Young Joseph, Joseph in Egypt, Joseph the Provider",,,"page 360 location 5511-5512",,"July 17, 2023","Kindle Import Timestamp 1692418692555","August 19, 2023 2:18 pm",
"Thomas Mann","In her fifth month, Laban insisted Rachel be taken to Haran, to a seer and priest of Sin’s temple, E-hulhul, so that he might foretell both her and her child’s future through augury. In the presence of others, Jacob held to his principles and declined to participate, but ultimately he was no less feverish than his kin to know the results and always the first to demand nothing be left undone.","Joseph and His Brothers: The Stories of Jacob, Young Joseph, Joseph in Egypt, Joseph the Provider",,,"page 363 location 5566-5568",,"July 17, 2023","Kindle Import Timestamp 1692418692555","August 19, 2023 2:18 pm",
"Thomas Mann","Jacob, who had waved as they left, stayed at home in order not to see the pompous abomination of E-hulhul and be offended by its adjoining house of female prostitutes and boy lovers, who to honor their idol surrendered themselves to strangers for considerable sums.","Joseph and His Brothers: The Stories of Jacob, Young Joseph, Joseph in Egypt, Joseph the Provider",,,"page 364 location 5575-5577",,"July 17, 2023","Kindle Import Timestamp 1692418692555","August 19, 2023 2:18 pm",
"Thomas Mann","Yes, the verdict, the judgment spoken by the oil—it was a murky and ambiguous matter; in possessing it, one was not much wiser than before, for it was both consolation and threat in one—but surely that was how the future had to sound if it could speak, and at least they had heard some sound from it, if only a buzzing, words spoken through lips shut tight.","Joseph and His Brothers: The Stories of Jacob, Young Joseph, Joseph in Egypt, Joseph the Provider",,,"page 366 location 5609-5612",,"July 17, 2023","Kindle Import Timestamp 1692418692555","August 19, 2023 2:18 pm",
"Thomas Mann","He held Nimrod of Babel in profound derision, a sentiment inherited from the primal wanderer.","Joseph and His Brothers: The Stories of Jacob, Young Joseph, Joseph in Egypt, Joseph the Provider",,,"page 369 location 5646-5647",,"July 17, 2023","Kindle Import Timestamp 1692418692555","August 19, 2023 2:18 pm",
"Tamsyn Muir","“Things are changing. I used to think we were","Gideon the Ninth",,,"page 50 location 752-753",,"July 21, 2023","Kindle Import Timestamp 1692418692555","August 19, 2023 2:18 pm",
"Tamsyn Muir","“Things are changing. I used to think we were waiting for something …","Gideon the Ninth",,,"page 50 location 752-753",,"July 21, 2023","Kindle Import Timestamp 1692418692555","August 19, 2023 2:18 pm",
"Tamsyn Muir","“Things are changing. I used to think we were waiting for something … and now I think we’re just waiting to die.”","Gideon the Ninth",,,"page 50 location 752-753",,"July 21, 2023","Kindle Import Timestamp 1692418692555","August 19, 2023 2:18 pm",
"Tamsyn Muir","“Anyone can learn to fight. Hardly anyone learns to think.”","Gideon the Ninth",,,"page 57 location 862-862",,"July 21, 2023","Kindle Import Timestamp 1692418692555","August 19, 2023 2:18 pm",
"Tamsyn Muir","“I acknowledge your argument,” she said. “I disagree with it, but I see the margin of error. Fine.”","Gideon the Ninth",,,"page 147 location 2248-2248",,"July 24, 2023","Kindle Import Timestamp 1692418692555","August 19, 2023 2:18 pm",
"Tamsyn Muir","Since when was power goodness, or cleverness truth?","Gideon the Ninth",,,"page 316 location 4842-4842",,"July 30, 2023","Kindle Import Timestamp 1692418692555","August 19, 2023 2:18 pm",
"Dan Millman","“Warriors, warriors we call ourselves. We fight for splendid virtue, for high endeavor, for sublime wisdom, therefore we call ourselves warriors.” --AUNGUTTARANIKAYA","Way of the Peaceful Warrior",,,"page 7 location 98-99",,"August 6, 2023","Kindle Import Timestamp 1692418692555","August 19, 2023 2:18 pm",
"Dan Millman","Life is the only real teacher. It offers many experiences, and if experience alone brought wisdom and fulfillment, then elderly people would be happy, enlightened masters.   But the lessons of experience are hidden.","Way of the Peaceful Warrior",,,"page 19 location 284-286",,"August 8, 2023","Kindle Import Timestamp 1692418692555","August 19, 2023 2:18 pm",
"Dan Millman","Everything you'll ever need to know is within you; the secrets of the universe are imprinted on the cells of your body. But you haven't learned inner vision; you don't know how to read the body.","Way of the Peaceful Warrior",,,"page 20 location 304-305",,"August 8, 2023","Kindle Import Timestamp 1692418692555","August 19, 2023 2:18 pm",
"Dan Millman","You are ignorant of where the Universe is, and thus, where you are. In fact, you have no knowledge of where anything is; nor do you know what anything is or how it came to be. It's a mystery.”","Way of the Peaceful Warrior",,,"page 23 location 349-350",,"August 8, 2023","Kindle Import Timestamp 1692418692555","August 19, 2023 2:18 pm",
"Dan Millman","There was once a beloved king whose castle was on a high hill, overlooking his shire. He was so popular that the nearby townspeople sent him gifts daily, and his birthday celebration was enjoyed throughout the kingdom. The people loved him for his renowned wisdom and fair judgments.   One day, tragedy struck the town. The water supply was polluted, and every man, woman, and child went insane. Only the king, who had a private spring, was spared.   Soon after the tragedy, the mad townspeople began speaking of how the king was acting “strangely” and how his judgments were poor and his wisdom a sham. Many even went so far as to say that the king had gone crazy. His popularity soon vanished. No longer did the people bring him gifts or celebrate his birthday.   The lonely king, high on the hill, had no company at all. One day he decided to leave the hill and pay a visit to the town. It was a warm day, and so he drank from the village fountain.   That night there was a great celebration. The people all rejoiced, for their beloved king had “regained his sanity.”","Way of the Peaceful Warrior",,,"page 28 location 425-435",,"August 8, 2023","Kindle Import Timestamp 1692418692555","August 19, 2023 2:18 pm",
"Dan Millman","saying of Confucius,” he smiled. “Only the supremely wise and the ignorant do not alter.","Way of the Peaceful Warrior",,,"page 40 location 601-602",,"August 10, 2023","Kindle Import Timestamp 1692418692555","August 19, 2023 2:18 pm",
"Dan Millman","It is the same with all your emotions. They're your knee-jerk responses to thoughts you can't control.","Way of the Peaceful Warrior",,,"page 60 location 908-908",,"August 11, 2023","Kindle Import Timestamp 1692418692555","August 19, 2023 2:18 pm",
"Dan Millman","Alexander the Great, marching with his armies through the desert, came upon two thick ropes tied in the massive, convoluted Gordian knot. No one had been able to untie it until the challenge was given to Alexander. Without a moment's hesitation he drew his sword and in one powerful blow he cut the knot in two. He was a warrior!    “That is how you must learn to attack the knots of your mind--with the sword of meditation. Until one day you transcend your need for any weapon at all.”","Way of the Peaceful Warrior",,,"page 84 location 1284-1289",,"August 12, 2023","Kindle Import Timestamp 1692418692555","August 19, 2023 2:18 pm",
"Dan Millman","Then I knew that awareness is how the human being experiences the light of consciousness. I learned the meaning of attention--it is the intentional channeling of awareness. I felt my body again, as a hollow vessel. I looked at my legs; they filled with warm, radiant light, disappearing into brightness. I looked at my arms, with the same result. I focused attention on every part of the body, until I became wholly light once again. Finally, I realized the process of real meditation to expand awareness, to direct attention, to ultimately surrender to the Light of Consciousness.","Way of the Peaceful Warrior",,,"page 88 location 1341-1344",,"August 13, 2023","Kindle Import Timestamp 1692418692555","August 19, 2023 2:18 pm",
"Dan Millman","One is insight, the willing of attention, the channeling of awareness to focus precisely on what you want to see. The other process is surrendering, letting go of all arising thoughts. That is real meditation; that is how you cut free of the mind.”","Way of the Peaceful Warrior",,,"page 90 location 1376-1378",,"August 13, 2023","Kindle Import Timestamp 1692418692555","August 19, 2023 2:18 pm",
"Dan Millman","“Because your greatest fear is death and your deepest craving is survival. You want Forever, you desire Eternity. In your deluded belief that you are this 'mind' or 'spirit' or 'soul', you find the escape clause in your contract with mortality.","Way of the Peaceful Warrior",,,"page 92 location 1410-1411",,"August 14, 2023","Kindle Import Timestamp 1692418692555","August 19, 2023 2:18 pm",
"Dan Millman","“A warrior doesn’t seek pain, but if pain comes, he uses it.","Way of the Peaceful Warrior",,,"page 107 location 1627-1627",,"August 16, 2023","Kindle Import Timestamp 1692418692555","August 19, 2023 2:18 pm",
"Dan Millman","When you learn to make proper use of your anger, you can change fear and sorrow to anger, then turn anger to action. That’s the body’s secret of internal alchemy.”","Way of the Peaceful Warrior",,,"page 117 location 1788-1789",,"August 16, 2023","Kindle Import Timestamp 1692418692555","August 19, 2023 2:18 pm",
"Dan Millman","“You don’t need to control emotion,” he said. “Emotions are natural, like passing weather. Sometimes it’s fear, sometimes sorrow or anger. Emotions are not the problem. The key is to transform the energy of emotion into constructive action.”","Way of the Peaceful Warrior",,,"page 117 location 1792-1794",,"August 16, 2023","Kindle Import Timestamp 1692418692555","August 19, 2023 2:18 pm",
"Dan Millman","I eat only what is wholesome, and I eat only as much as I need. In order to appreciate what you call natural foods, you have to sharpen your instincts;","Way of the Peaceful Warrior",,,"page 122 location 1860-1861",,"August 16, 2023","Kindle Import Timestamp 1692418692555","August 19, 2023 2:18 pm",
"Dan Millman","You must learn to enjoy the entire process--the hunger beforehand, the careful preparation, setting an attractive table, chewing, breathing, smelling, tasting, swallowing, and the feeling of lightness and energy after the meal. Finally, you can enjoy the full and easy elimination of the food after it's digested. When you pay attention to all these elements, you'll begin to appreciate simple meals; you won't need as much food.","Way of the Peaceful Warrior",,,"page 123 location 1882-1885",,"August 16, 2023","Kindle Import Timestamp 1692418692555","August 19, 2023 2:18 pm",
"Dan Millman","In fact, he didn't want me to talk at all unless it was absolutely necessary. “No more idle jabbering,” he said. “What comes out of your mouth is as important as what goes into it.”","Way of the Peaceful Warrior",,,"page 126 location 1930-1931",,"August 16, 2023","Kindle Import Timestamp 1692418692555","August 19, 2023 2:18 pm",
"Dan Millman","“The true martial arts teach harmony, or nonresistance--the way of the trees bending in the wind, for example. This attitude is far more important than physical technique.”","Way of the Peaceful Warrior",,,"page 164 location 2507-2508",,"August 18, 2023","Kindle Import Timestamp 1692418692555","August 19, 2023 2:18 pm",
"Dan Millman","“You now see everything through a veil of associations about things, projected over a direct, simple awareness. You've 'seen it all before'; it's like watching a movie for the twentieth time. You see only memories of things, so you become bored. Boredom, you see, is fundamental non-awareness of life; boredom is awareness, trapped in the mind. You'll have to lose your mind before you can come to your senses.”","Way of the Peaceful Warrior",,,"page 178 location 2719-2722",,"August 18, 2023","Kindle Import Timestamp 1692418692555","August 19, 2023 2:18 pm",
"Dan Millman","“If you have enough money to satisfy your desires, Dan, you are rich. But there are two ways to be rich: You can earn, inherit, borrow, beg, or steal enough money to meet expensive desires; or, you can cultivate a simple lifestyle of few desires; that way you always have more than enough money.","Way of the Peaceful Warrior",,,"page 180 location 2755-2757",,"August 18, 2023","Kindle Import Timestamp 1692418692555","August 19, 2023 2:18 pm",
"Dan Millman","From now on, whenever your attention begins to drift off to other times and places, I want you to snap back. Remember, the time is now and the place is here.”","Way of the Peaceful Warrior",,,"page 181 location 2770-2771",,"August 18, 2023","Kindle Import Timestamp 1692418692555","August 19, 2023 2:18 pm",
"Dan Millman","This is natural; action is always in the present, because it is an expression of the body, which can only exist in the present. But the mind, you see, is like a phantom, and, in fact, never exists in the present. Its only power over you is to draw your attention out of the present.”","Way of the Peaceful Warrior",,,"page 183 location 2800-2802",,"August 18, 2023","Kindle Import Timestamp 1692418692555","August 19, 2023 2:18 pm",
"Dan Millman","“Just keep your attention in the present moment, Dan, and you'll be free of thought. When thoughts touch the present, they dissolve.”","Way of the Peaceful Warrior",,,"page 186 location 2846-2847",,"August 18, 2023","Kindle Import Timestamp 1692418692555","August 19, 2023 2:18 pm",